{
  "schema_version": 1,
  "review_id": "r_35401b4c784d42d756d6e766",
  "round": 3,
  "submission_id": "s_0a1b2c3d4e5f60718293a4b5",
  "submitted_at": "2026-10-25T15:04:05Z",
  "document": {
    "id": "DESIGN-0024",
    "path": "docs/design/0024-docz-review.md",
    "type": "design",
    "content_sha256": "afa785fc8646bc737d991fe519abf88956780f429fb0e16e352a71a7de9cf835"
  },
  "outcome": "dismissed",
  "questions": [],
  "annotations": [],
  "status": "",
  "findings": []
}
