{
  "schema_version": 1,
  "review_id": "9f1c2a4e-0b7d-4f7e-9a51-3c8e2d6b1f00",
  "round": 2,
  "submission_id": "s_0a1b2c3d4e5f60718293a4b5",
  "submitted_at": "2026-10-25T15:04:05Z",
  "document": {
    "id": "DESIGN-0024",
    "path": "docs/design/0024-docz-review.md",
    "type": "design",
    "content_sha256": "afa785fc8646bc737d991fe519abf88956780f429fb0e16e352a71a7de9cf835"
  },
  "outcome": "changes",
  "questions": [
    {
      "number": 1,
      "choice": "a"
    },
    {
      "number": 2,
      "choice": "other",
      "text": "Use the shared cache.",
      "note": "Ask platform first."
    }
  ],
  "annotations": [
    {
      "order": 1,
      "kind": "document",
      "text": "Shorten the background."
    },
    {
      "order": 2,
      "kind": "comment",
      "anchor": {
        "region": "detailed-design",
        "ordinal": 3,
        "heading": "Notes",
        "exact": "notes",
        "prefix": "The second ",
        "suffix": " section, under",
        "line": 80,
        "resolution": "exact"
      },
      "selection": "notes",
      "text": "Which notes?"
    },
    {
      "order": 3,
      "kind": "replace",
      "anchor": {
        "region": "detailed-design",
        "ordinal": 2,
        "heading": "Notes",
        "exact": "caf\u00e9 notes \u2615",
        "prefix": "The second ",
        "suffix": " section, under",
        "line": 53,
        "resolution": "ambiguous"
      },
      "selection": "caf\u00e9 notes \u2615",
      "replacement": "coffee notes"
    },
    {
      "order": 4,
      "kind": "delete",
      "anchor": {
        "region": "detailed-design",
        "ordinal": 1,
        "heading": "Notes",
        "exact": "The cache is warm.",
        "prefix": "The second ",
        "suffix": " section, under",
        "line": 43,
        "resolution": "lost"
      },
      "selection": "The cache is warm."
    },
    {
      "order": 5,
      "kind": "looks-good",
      "anchor": {
        "region": "detailed-design",
        "ordinal": 1,
        "heading": "Notes",
        "exact": "Postgres",
        "prefix": "The second ",
        "suffix": " section, under",
        "line": 40,
        "resolution": "exact"
      },
      "selection": "Postgres"
    }
  ],
  "status": "In Review",
  "findings": [
    {
      "code": "content.not-bullets",
      "line": 11,
      "action": "fix"
    },
    {
      "code": "region.missing",
      "line": 0,
      "action": "dismiss"
    }
  ]
}
